id,fecha_evento,planeado,evento,lugar,intrusion
635,11/18/2021,false,Echo India Yankee Alfa Whiskey Oscar Tango Zulu Quebec Charlie X-ray Romeo Kilo Victor Sierra Hotel,NA,true
636,9/22/2021,true,Foxtrot X-ray Uniform Echo Charlie Kilo Yankee Juliett Whiskey Delta Lima Tango Zulu Papa Sierra Alfa November Hotel Mike,NA,true
637,9/16/2021,true,Uniform Tango Lima Mike Charlie Romeo Golf Juliett Kilo Victor,AF,false
638,10/11/2021,true,Golf Delta Whiskey Lima X-ray Mike Bravo Sierra Charlie Oscar Yankee Juliett Tango Alfa Romeo Papa Zulu Kilo Hotel,OC,true
639,10/17/2021,true,Tango Juliett India Mike Hotel Echo Uniform Foxtrot Zulu Quebec Bravo Charlie Sierra,NA,false
640,12/16/2021,true,Whiskey Uniform India Mike Yankee Quebec Zulu Lima Delta Golf Kilo Hotel Oscar Charlie Victor Tango,OC,true
641,7/18/2021,true,Romeo Kilo Alfa Lima Yankee Hotel Sierra Delta Charlie Echo Whiskey Papa,OC,false
642,10/31/2021,true,Echo November Juliett Whiskey Sierra Uniform Charlie Lima Bravo Zulu Quebec Delta Hotel Tango Oscar Papa India Kilo,SA,true
643,12/10/2021,true,Uniform Lima Hotel Alfa Bravo Victor Quebec X-ray Golf Romeo,NA,true
644,11/27/2021,false,Victor Kilo Zulu Juliett Romeo Tango Hotel Oscar Sierra Golf India Quebec,AS,true
645,12/9/2021,false,Alfa Foxtrot Echo Papa Golf Tango Whiskey Yankee Kilo Delta Romeo Mike,NA,true
646,11/6/2021,false,November Romeo Tango Charlie X-ray Oscar Sierra Golf Kilo Papa Whiskey Quebec Lima Victor,NA,true
647,12/20/2021,false,Romeo Delta Mike Oscar Kilo Hotel Lima Sierra Foxtrot Tango Charlie Uniform,AS,true
648,9/13/2021,true,Yankee Mike Echo Bravo Golf Quebec India Hotel Kilo Zulu Foxtrot Alfa Victor November Sierra,NA,false
649,7/16/2021,true,Lima Oscar Bravo Papa Victor Hotel Whiskey Zulu Echo Golf,AF,true
650,11/10/2021,false,Yankee Foxtrot Quebec Kilo Hotel Charlie Sierra Bravo Papa Oscar Juliett Mike Alfa Tango Golf Lima Delta Whiskey November,NA,false
651,11/8/2021,false,Yankee Mike Whiskey India Delta Juliett Tango Quebec Victor Oscar Kilo Golf Hotel,NA,true
652,11/27/2021,true,Zulu Sierra Yankee Kilo Golf Romeo Echo Delta Charlie Alfa Lima Mike Quebec Oscar,AF,true
653,10/8/2021,true,Zulu Papa X-ray Mike Romeo Quebec Tango Victor India Hotel Charlie Kilo Yankee Echo Oscar Golf Sierra,OC,false
654,8/19/2021,false,Lima November Charlie India Delta Hotel Alfa Oscar Tango Juliett Zulu Kilo Uniform Foxtrot Whiskey Bravo Papa Yankee,AF,false
655,9/15/2021,true,Yankee November Charlie Romeo Delta Tango Papa Zulu Quebec Victor Sierra Lima India Whiskey Juliett Alfa Kilo,OC,true
656,8/19/2021,false,Mike Whiskey Juliett Hotel November Alfa Kilo Foxtrot Oscar Papa Delta Zulu Quebec,AF,true
657,7/7/2021,true,November Delta Charlie Quebec Sierra Bravo Juliett Tango Mike X-ray Echo Oscar Hotel Papa,AS,false
658,9/26/2021,false,November Papa Echo Oscar Uniform Mike India Foxtrot Bravo Yankee,OC,true
659,12/8/2021,true,X-ray Echo Juliett Zulu Yankee Hotel Golf November Sierra Alfa Lima Romeo Papa Quebec Victor,NA,true
660,9/2/2021,true,Uniform Quebec Oscar Echo Juliett Golf Foxtrot Romeo Yankee Zulu Lima,SA,true
661,7/24/2021,true,Oscar Romeo Tango Foxtrot Alfa Papa Golf India Sierra Juliett Victor Charlie Uniform,NA,false
662,7/18/2021,false,Bravo X-ray Juliett Oscar India Foxtrot Golf Whiskey Uniform Tango Hotel Alfa November,OC,true
663,11/4/2021,false,Mike Quebec November Papa Kilo Lima India Hotel Alfa Yankee Victor Foxtrot Echo Juliett Romeo,NA,true
664,11/30/2021,true,India Foxtrot Oscar Uniform Victor Mike Zulu Sierra Yankee Lima Romeo X-ray Hotel Charlie Quebec Juliett Kilo Whiskey,AF,false
665,8/13/2021,false,Sierra Mike Tango Charlie Foxtrot Papa Kilo X-ray Uniform Alfa Lima Bravo November Yankee Oscar,AS,false
666,9/22/2021,true,Charlie Whiskey Mike Kilo Alfa Lima Juliett Hotel Sierra India Quebec Oscar Bravo Victor X-ray Romeo Papa Echo Yankee Tango,AF,true
667,8/24/2021,false,Kilo Hotel November Victor Sierra Mike Bravo India X-ray Oscar Golf Juliett Yankee Foxtrot Tango Echo Zulu Delta,NA,false
668,10/4/2021,true,Sierra Uniform Charlie Tango Golf Alfa Kilo Foxtrot Hotel Mike India Whiskey Quebec,NA,false
669,7/20/2021,false,Foxtrot Sierra Yankee Mike Alfa Oscar Quebec Zulu Echo Delta Uniform Romeo Papa November Hotel India Lima Charlie,OC,true
670,12/3/2021,true,Foxtrot November Mike Victor Lima Alfa Golf Oscar Echo Bravo,AS,true
671,10/16/2021,true,Mike Hotel Zulu Tango November Oscar Whiskey Quebec Kilo Delta Charlie Yankee Victor Echo Uniform Papa,AS,true
672,10/26/2021,true,India Lima Romeo Bravo Echo X-ray Golf Zulu Alfa Oscar Hotel Charlie Quebec Delta Whiskey Juliett Tango,AS,true
673,7/26/2021,false,Tango Juliett Mike Uniform Foxtrot November India Papa Romeo Hotel,OC,false
674,10/25/2021,false,Foxtrot Zulu Whiskey India Sierra X-ray Victor Mike Papa November Oscar Delta Bravo Lima Hotel Uniform Charlie Golf,AS,false
675,9/5/2021,true,Alfa Bravo November Charlie Juliett Kilo Oscar India Quebec Zulu Whiskey Hotel Golf Romeo Mike Sierra Papa X-ray Victor,EU,false
676,7/2/2021,false,Foxtrot November Tango Sierra Mike Hotel Oscar Golf India Romeo Juliett Delta Charlie Victor Echo Bravo Yankee Whiskey Zulu,EU,false
677,11/14/2021,false,Zulu November Echo Foxtrot Mike Romeo Whiskey Papa Uniform Oscar Alfa Tango Sierra Golf Hotel India Lima Victor,AF,true
678,10/8/2021,false,Romeo Victor India November Hotel Sierra Charlie Quebec Echo Mike X-ray Delta,EU,true
679,8/17/2021,true,Juliett Delta Alfa Hotel Echo Bravo Golf X-ray Zulu November Romeo Lima Quebec Oscar Kilo Foxtrot Mike India Victor,AS,true
680,10/26/2021,false,Papa Foxtrot Sierra Golf Victor Quebec Kilo Bravo Echo November Mike Whiskey India Zulu Tango X-ray,AS,false
681,10/21/2021,false,Sierra Tango India X-ray Lima Foxtrot Kilo Delta Quebec Oscar Yankee,NA,false
682,12/23/2021,true,Whiskey Yankee Romeo Charlie Sierra Hotel Tango Oscar X-ray Victor November Quebec India,NA,false
683,11/18/2021,false,Mike Romeo Delta Victor Whiskey Zulu Lima Uniform Golf Kilo India Echo Hotel,SA,true
684,12/22/2021,true,Whiskey November Delta Hotel India Romeo Golf X-ray Uniform Tango Mike Papa Charlie Kilo Echo Victor Bravo,AF,true
685,10/11/2021,false,Golf Charlie Hotel Whiskey India Papa Juliett Echo Alfa Lima Foxtrot Oscar X-ray Kilo Yankee Quebec Mike Victor Bravo November,EU,true
686,10/27/2021,true,Hotel Tango Sierra Alfa Charlie Papa Lima Whiskey Bravo Juliett Kilo Victor Mike Quebec,EU,true
687,10/17/2021,false,X-ray Foxtrot Zulu Delta Juliett Whiskey Kilo India Sierra Bravo Romeo Echo Hotel Golf Tango Mike,SA,false
688,12/15/2021,true,Juliett Bravo Oscar Echo Lima Yankee Quebec Hotel Sierra X-ray India Golf November Romeo Foxtrot Alfa Zulu Victor Papa,NA,true
689,11/18/2021,true,Romeo Hotel Alfa Quebec November Tango Lima Mike Kilo Victor Bravo Yankee,AS,true
690,12/26/2021,false,Lima Zulu Charlie India November Quebec Romeo Uniform Echo Papa,NA,false
691,8/31/2021,false,Hotel Romeo Quebec Juliett Kilo Whiskey Echo X-ray India Sierra November Oscar Golf Bravo Foxtrot Mike Delta Victor Lima Tango,AS,true
692,12/8/2021,false,Papa X-ray Delta Echo Lima Uniform Kilo Oscar Whiskey Juliett Sierra Quebec Romeo India Foxtrot Alfa Charlie Tango Hotel,AS,true
693,10/6/2021,true,Tango Alfa Juliett Delta Charlie November Echo Quebec Yankee Sierra Foxtrot Lima X-ray,AF,true
694,11/23/2021,false,Lima Sierra Zulu Victor Charlie Bravo Delta Juliett November Whiskey Quebec Hotel Romeo Echo Mike Alfa Papa India,AS,true
695,12/8/2021,true,Romeo Golf Mike Uniform Hotel Victor X-ray Whiskey India Oscar Zulu Kilo Sierra Papa Echo Delta,NA,true
696,12/8/2021,true,Tango India Uniform November Victor Kilo Charlie Delta Foxtrot Papa Whiskey Sierra Alfa X-ray Hotel Golf Lima Bravo,AS,false
697,9/21/2021,false,Delta Foxtrot Alfa Lima Bravo Echo Uniform November Juliett Zulu Hotel Charlie Victor Tango Romeo Mike India Yankee Papa Whiskey,NA,false
698,12/14/2021,false,Quebec Victor Whiskey Lima Bravo Sierra Kilo Oscar X-ray Romeo Golf,SA,true
699,9/4/2021,true,Delta X-ray Romeo Lima Juliett Echo Tango Whiskey Charlie Papa Yankee Bravo,NA,false
700,8/2/2021,false,Quebec Delta Golf Romeo Lima November Yankee Uniform Tango Whiskey Echo Kilo,SA,true
701,12/5/2021,false,Oscar Romeo Uniform Papa X-ray Bravo Tango Delta Alfa Juliett Sierra Zulu Hotel Mike Whiskey,NA,true
702,12/8/2021,false,Charlie Quebec Sierra Romeo Tango Uniform Kilo Hotel Zulu Whiskey November Yankee Foxtrot X-ray Echo Alfa Lima Golf Papa,AF,false
703,7/11/2021,true,Tango Delta Uniform Charlie Sierra Papa Romeo Echo Golf Alfa Juliett,AS,true
704,11/2/2021,true,Zulu Kilo Lima Romeo Mike Echo Quebec Golf Uniform Hotel Delta Sierra Bravo India Foxtrot Papa Juliett Tango,AS,false
705,11/20/2021,false,Uniform November Kilo Zulu Oscar Juliett Lima Sierra Whiskey Tango Bravo,NA,true
706,11/11/2021,true,Tango Kilo Yankee Uniform Hotel Whiskey November Charlie Romeo Foxtrot Echo Sierra Zulu India,SA,false
707,10/3/2021,false,India Papa Echo Bravo Quebec Sierra Hotel Uniform Lima Oscar Whiskey Golf Charlie,SA,true
708,7/16/2021,false,Charlie Juliett India Kilo Echo Tango Hotel Foxtrot Alfa Uniform Oscar Yankee Golf November Romeo Mike Quebec,NA,false
709,8/26/2021,false,Tango Bravo Lima Foxtrot Quebec Alfa Papa Hotel Echo Victor Kilo X-ray November Yankee Golf,OC,false
710,7/16/2021,true,Victor Alfa November Romeo Echo Bravo Kilo Zulu Mike Delta Charlie Tango Golf Juliett Uniform Foxtrot Quebec Hotel X-ray Whiskey,NA,false
711,7/7/2021,true,Delta X-ray Juliett Sierra Papa Charlie Whiskey Echo Victor Bravo Alfa Hotel Yankee,NA,true
712,9/10/2021,false,Golf Quebec Victor Oscar Whiskey November Echo Romeo Delta India Bravo Tango X-ray Uniform Papa,AS,true
713,7/5/2021,false,Yankee Foxtrot Oscar November Whiskey Papa X-ray Juliett Quebec Golf Alfa Echo Uniform Sierra Victor India Bravo,NA,true
714,12/6/2021,true,Hotel X-ray Charlie Victor Zulu Delta Yankee Kilo Alfa Uniform,OC,false
715,12/2/2021,true,Foxtrot Alfa Mike Charlie Sierra X-ray India Whiskey Golf Quebec Zulu Hotel Echo November Romeo Papa Tango Delta Yankee,OC,true
716,7/20/2021,true,Zulu Hotel Delta Yankee Sierra Lima Juliett Papa Kilo Uniform India X-ray Charlie Echo November Oscar Foxtrot Bravo Mike Quebec,EU,true
717,12/4/2021,false,Bravo X-ray Zulu Oscar Golf Sierra Delta Uniform Kilo Papa Tango Whiskey Hotel Juliett Alfa India November,NA,false
718,10/27/2021,true,Kilo Victor Mike Foxtrot Uniform Whiskey X-ray Alfa Yankee Sierra Delta November Charlie Echo Quebec Romeo Zulu Tango Golf India,NA,false
719,10/29/2021,false,X-ray Victor Alfa November Sierra Echo Foxtrot Charlie Oscar Papa Uniform Golf Tango Whiskey Bravo Delta India Lima Hotel Zulu,OC,false
720,7/14/2021,false,Uniform Bravo Echo India Golf Quebec Juliett Sierra Yankee Victor Kilo,NA,false
721,11/18/2021,true,Whiskey Quebec Zulu Alfa November Victor Yankee Hotel Charlie India Echo Delta Kilo Oscar,AS,true
722,8/18/2021,true,India Charlie Juliett Alfa Delta Oscar Yankee Hotel Lima Victor Foxtrot November Uniform Tango Zulu Golf Romeo,NA,true
723,10/7/2021,false,India Romeo Alfa Quebec November Hotel Delta Golf Foxtrot Sierra Tango Kilo Uniform X-ray Juliett Yankee Echo Papa Lima,OC,false
724,8/26/2021,false,November Romeo Golf India Alfa Oscar Yankee Foxtrot Delta Mike,AF,false
725,10/19/2021,false,Yankee X-ray Mike Victor Foxtrot Quebec Alfa Golf Uniform Tango Oscar Hotel Whiskey Bravo India Delta Romeo Kilo Juliett,NA,true
726,7/30/2021,true,Mike India Victor Sierra Alfa Hotel Charlie Juliett Lima Kilo,OC,false
727,12/28/2021,true,Quebec Tango Yankee November Papa Golf Zulu Romeo Echo Alfa Lima Victor Foxtrot Hotel Mike Delta Bravo Uniform,OC,false
728,11/24/2021,false,Mike Whiskey Charlie Quebec Delta Zulu Hotel Uniform Juliett November Echo Golf Foxtrot Kilo Tango Victor Yankee Alfa India Oscar,NA,true
729,8/22/2021,true,Yankee Charlie Quebec Kilo Alfa November Golf Romeo Sierra Uniform Bravo Delta X-ray Zulu Hotel India Echo,NA,false
730,9/1/2021,true,Zulu Charlie India Victor Delta Kilo Quebec Mike Uniform Foxtrot X-ray Alfa Lima Hotel Tango Sierra Echo,OC,false
731,9/15/2021,true,Victor India Charlie Whiskey X-ray Quebec November Mike Delta Papa Uniform Bravo,NA,false
732,8/15/2021,false,X-ray November Tango Juliett Foxtrot Sierra Papa India Yankee Echo,SA,false
733,12/1/2021,true,Oscar Foxtrot Golf Quebec Hotel Alfa Yankee November Charlie Juliett Bravo Kilo Romeo Lima India Mike,AS,false
734,8/29/2021,true,Delta Charlie Kilo Romeo Oscar Bravo X-ray Quebec Juliett Lima Mike Alfa Papa,NA,false
735,10/29/2021,true,Alfa Golf Kilo Victor Mike Echo Romeo Papa Juliett Uniform Quebec Bravo Oscar November Foxtrot,NA,false
736,9/13/2021,false,Mike Quebec Tango Alfa Foxtrot Yankee Papa Golf Sierra Whiskey Oscar,SA,true
737,10/4/2021,false,Tango Charlie Kilo Oscar Whiskey Uniform Romeo Yankee Papa X-ray Foxtrot India Golf Bravo November Juliett Echo Sierra Zulu Hotel,AF,true
738,8/7/2021,false,Lima Yankee Golf Juliett Romeo Mike Uniform Whiskey India Kilo Sierra November Bravo Papa Victor,OC,false
739,10/13/2021,false,Foxtrot Sierra November Romeo Charlie Victor Tango Papa Quebec X-ray Oscar,AS,false
740,10/20/2021,false,Juliett Delta Lima Zulu X-ray Victor Tango Quebec Golf India Sierra Romeo November Whiskey Bravo Echo Kilo Alfa Foxtrot Oscar,NA,false
741,7/29/2021,true,November Whiskey Quebec Juliett Tango Romeo Echo Golf India Hotel Foxtrot Alfa Yankee Charlie Lima Sierra Mike Bravo Oscar,NA,false
742,8/31/2021,true,Sierra Romeo Alfa Tango Lima Hotel Quebec Papa Mike Uniform Yankee X-ray Delta Echo Bravo,SA,true
743,11/9/2021,true,Zulu Kilo Papa Lima November Charlie Bravo Juliett Alfa India Tango Whiskey Hotel Romeo Foxtrot Delta Echo Quebec Oscar Mike,AF,true
744,11/15/2021,false,Mike Lima India Hotel Romeo Echo Bravo November Tango Delta Whiskey Quebec,NA,true
745,12/21/2021,true,Golf Echo Uniform Delta Bravo Victor Alfa Juliett India Romeo Mike Lima Hotel Yankee Quebec X-ray Foxtrot Oscar,NA,false
746,9/13/2021,true,November Juliett Lima Mike Delta Sierra India Tango Uniform Kilo Quebec Alfa Echo,AS,true
747,8/5/2021,false,Yankee Mike Whiskey Juliett Hotel Kilo Alfa India Oscar X-ray Victor Zulu Uniform Echo Papa Romeo Lima Foxtrot Golf November,AS,false
748,12/7/2021,true,Tango Mike Echo Zulu Victor Lima Foxtrot Romeo Papa Yankee Hotel Delta Sierra,AS,false
749,8/9/2021,true,Oscar Papa November X-ray Mike Tango Charlie Sierra Romeo Hotel Kilo Golf Zulu Bravo Uniform Quebec,NA,false
750,12/26/2021,true,Papa Alfa India Charlie Zulu X-ray Victor Oscar Kilo Uniform Lima Echo Mike Yankee Golf,AS,true
751,11/13/2021,true,Mike India Whiskey Lima Kilo November Alfa Sierra Yankee Oscar,NA,true
752,10/6/2021,false,Bravo Echo Oscar Romeo November Foxtrot Whiskey Mike Victor Lima Yankee Hotel Zulu Kilo Charlie India Sierra,AF,true
753,8/4/2021,false,Sierra Juliett Bravo November Golf Whiskey Alfa Lima Delta Hotel Victor X-ray Echo,AF,true
754,10/13/2021,false,Alfa Quebec Romeo Bravo Foxtrot Uniform Sierra Tango November Golf Papa Charlie,SA,false
755,10/8/2021,true,Yankee Uniform Tango November Hotel Victor Mike Echo Papa X-ray Oscar,AF,true
756,10/1/2021,false,Romeo Zulu Charlie Juliett November Golf Oscar Echo X-ray Bravo Victor Foxtrot Hotel,SA,false
757,7/31/2021,false,Kilo November Delta Zulu Uniform Foxtrot Quebec Bravo Whiskey Golf Romeo Lima Papa Victor,SA,false
758,7/1/2021,false,Uniform India Charlie Zulu Echo Tango Hotel Alfa Bravo Mike Quebec Victor Yankee Foxtrot Oscar Delta X-ray,SA,true
759,10/19/2021,true,Zulu Romeo Mike Alfa Papa Foxtrot Echo Golf Juliett Tango Delta Sierra,AS,false
760,10/12/2021,false,Mike Papa Foxtrot Hotel Bravo Uniform Lima Sierra Oscar Tango Victor November Delta Alfa X-ray India Quebec Zulu,AF,false
761,8/11/2021,true,Bravo Lima India Echo Golf Hotel Foxtrot Sierra Romeo Papa Charlie Uniform November Delta Zulu Mike Yankee,AF,false
762,7/21/2021,false,Kilo India Sierra Quebec Tango Lima Zulu Uniform Romeo Echo X-ray,NA,true
763,9/6/2021,true,Tango Echo Juliett Mike Golf Hotel X-ray Victor Uniform Quebec Sierra Papa,EU,false
764,12/3/2021,false,India Charlie November Uniform Mike Hotel Romeo Quebec Echo Victor Golf Bravo,AS,false
765,7/26/2021,true,Oscar Papa Foxtrot Charlie Juliett Hotel Romeo Echo Golf Sierra November Whiskey Mike Lima Tango X-ray,NA,false
766,11/3/2021,true,Charlie Romeo Zulu Victor X-ray Papa Mike India Alfa Tango Foxtrot Hotel Quebec Lima Delta,EU,true
767,12/18/2021,true,India Golf Tango Romeo Juliett Quebec Hotel Sierra Delta Charlie Kilo Yankee Mike X-ray Lima November Echo,EU,true
768,7/11/2021,true,Yankee India Delta Victor Kilo Lima Alfa X-ray Tango Uniform Echo Whiskey Hotel Quebec Juliett Romeo Foxtrot Mike Zulu Sierra,OC,true
769,10/29/2021,true,Lima Alfa Romeo Sierra Charlie Whiskey Golf Quebec Delta Hotel Zulu,NA,false
770,9/19/2021,true,Tango Bravo India Romeo Hotel Delta Mike Charlie Zulu Oscar Victor Juliett Kilo Echo Lima Whiskey Sierra Yankee Papa,AS,true
771,9/21/2021,true,November X-ray Alfa Echo Papa Foxtrot Juliett Golf Yankee Uniform Charlie Zulu,NA,false
772,12/4/2021,true,Echo Lima Tango Yankee Papa Sierra Oscar Whiskey November Uniform India Romeo Zulu Victor Bravo Mike Foxtrot Kilo Golf,AF,true
773,11/7/2021,true,Sierra Tango Oscar Uniform Quebec Golf Romeo X-ray November Charlie Zulu,NA,false
774,12/21/2021,true,Oscar Uniform Foxtrot Romeo X-ray Victor Echo Whiskey Lima Delta India Papa Kilo Mike Yankee,EU,false
775,11/8/2021,true,Sierra X-ray Lima Oscar Foxtrot Juliett Charlie Tango Uniform Zulu Victor Whiskey Alfa November India,NA,true
776,11/23/2021,false,Foxtrot Hotel India Bravo Alfa Echo Juliett Quebec Papa Delta Mike Victor Whiskey November Golf Zulu Charlie Yankee Kilo,NA,false
777,8/24/2021,true,Yankee Foxtrot Zulu November Tango Oscar Mike Uniform Bravo Golf,OC,false
778,11/15/2021,false,Mike Lima November Foxtrot Uniform Yankee Delta Charlie X-ray Papa Oscar India Golf Echo Zulu Kilo Tango Juliett,NA,true
779,12/8/2021,false,Whiskey Foxtrot Delta Victor Kilo Sierra Uniform X-ray Quebec Charlie Bravo,OC,true
780,7/26/2021,false,Victor Foxtrot Yankee Juliett Whiskey Papa Oscar Romeo Charlie Alfa Tango Mike Echo Zulu Sierra Kilo Golf,NA,false
781,10/15/2021,false,Echo Tango Golf Papa Hotel Romeo Quebec Bravo Sierra November Alfa X-ray Lima Foxtrot,SA,false
782,12/30/2021,true,Golf Lima Papa Oscar Sierra Foxtrot Charlie Delta Kilo Juliett Uniform Hotel Yankee Mike Whiskey Victor Echo Zulu X-ray,NA,false
783,12/2/2021,false,Mike Victor Uniform Sierra Zulu Tango Quebec Romeo X-ray Whiskey Alfa Lima Bravo,NA,true
784,12/22/2021,false,Uniform Kilo Juliett Oscar Lima Zulu November Mike Quebec Tango Delta Whiskey Golf Romeo X-ray Yankee Hotel Alfa,AF,true
785,11/7/2021,false,Golf Juliett Alfa Foxtrot Uniform November Oscar Whiskey Charlie Bravo,AS,true
786,12/12/2021,true,Zulu Bravo Golf Echo Sierra Lima Oscar Charlie Delta Papa Juliett,OC,true
787,12/16/2021,false,Lima Papa Victor Zulu November Juliett Alfa Uniform Whiskey Mike Hotel Yankee Foxtrot Tango India X-ray,AF,false
788,10/28/2021,true,X-ray Charlie Delta Foxtrot Golf India Zulu Echo Yankee Mike Papa Oscar Whiskey Uniform,NA,true
789,8/19/2021,true,Zulu November Quebec Echo Oscar Yankee Hotel Charlie Whiskey Alfa Mike Delta Victor Lima Papa,EU,false
790,8/17/2021,false,Mike Tango Uniform Foxtrot Echo Charlie Quebec India Alfa Victor Bravo Kilo November Golf Lima Yankee Oscar Delta Zulu Juliett,AF,false
791,12/20/2021,false,November Golf Juliett Echo Whiskey Victor Lima India Yankee Uniform Bravo Alfa Sierra,NA,true
792,8/5/2021,false,Echo X-ray Tango Juliett Papa Charlie Victor Kilo Romeo Bravo Whiskey Delta,NA,false
793,7/4/2021,true,Papa Tango Mike Delta Lima Yankee Whiskey Foxtrot Oscar India Bravo Hotel November,OC,false
794,10/22/2021,false,Mike India Victor Foxtrot Quebec Sierra Alfa Juliett Oscar Kilo Charlie Bravo Yankee Romeo Papa Uniform Echo Hotel Whiskey,NA,false
795,10/31/2021,true,Romeo Oscar Delta Alfa Golf Victor Uniform Whiskey Charlie Foxtrot India Juliett,SA,true
796,7/5/2021,false,Whiskey India Charlie Foxtrot Mike Echo Kilo Juliett Yankee X-ray Bravo Lima Golf Sierra November Delta Tango Victor Hotel,SA,true
797,8/31/2021,true,November Zulu Victor X-ray Romeo Uniform Tango Papa Bravo Quebec India Juliett,NA,false
798,9/28/2021,true,Hotel Yankee Echo Foxtrot Juliett Sierra Delta Romeo Zulu Lima Mike X-ray Charlie India Tango Bravo Quebec Kilo,NA,true
799,12/23/2021,true,Whiskey Uniform Zulu Quebec Oscar Hotel Bravo Victor Golf India Mike Echo,OC,false
800,12/25/2021,false,Yankee Juliett Papa Oscar Quebec Romeo November Hotel Golf Mike Tango Charlie India Echo Kilo,NA,true
801,12/8/2021,false,Hotel Charlie Golf Yankee India November X-ray Juliett Victor Kilo Papa Bravo Whiskey Foxtrot Tango,NA,false
802,7/26/2021,true,Tango Whiskey Delta Foxtrot Romeo Zulu Papa Victor Hotel Sierra Quebec Charlie Mike,NA,false
803,8/25/2021,false,Juliett Sierra Lima Uniform Echo Kilo November X-ray Tango Alfa Yankee Hotel Bravo Quebec Romeo India Golf Foxtrot Victor Oscar,AS,true
804,11/8/2021,true,November Whiskey Echo Yankee Delta India Bravo Hotel Quebec Oscar X-ray Juliett Lima,OC,false
805,12/25/2021,true,Juliett Romeo Yankee Uniform Zulu Golf Mike Oscar Echo India Sierra Whiskey Charlie Tango Papa Foxtrot Kilo,NA,true
806,11/16/2021,false,Echo Alfa Juliett Victor Bravo Golf India Whiskey Kilo Yankee Quebec November Charlie Romeo,OC,true
807,12/13/2021,true,Oscar Mike Whiskey Romeo Foxtrot Zulu Delta Charlie Papa Sierra Victor Kilo Yankee Juliett,NA,true
808,11/8/2021,true,Golf Oscar Uniform Foxtrot Whiskey Charlie Lima Delta Papa Hotel Yankee Bravo Zulu,AS,false
809,10/20/2021,false,Whiskey Foxtrot Sierra Charlie X-ray Echo Uniform India Hotel Zulu Delta Romeo Kilo Bravo Juliett Tango Yankee Papa Golf,NA,true
810,10/26/2021,true,Whiskey Delta X-ray Uniform Foxtrot Tango Sierra Papa Victor Juliett Mike Lima November Golf Bravo Echo Quebec,NA,true
811,11/12/2021,true,Golf Oscar Quebec Lima Hotel X-ray Papa Yankee Romeo Mike Zulu Whiskey Sierra Foxtrot Charlie Victor Kilo November,SA,false
812,11/2/2021,false,Charlie Juliett Foxtrot Hotel Golf November India Kilo Oscar Delta Quebec Zulu,NA,false
813,12/8/2021,true,India Romeo Uniform Whiskey Tango Sierra Oscar Foxtrot X-ray Victor Delta November Zulu,SA,true
814,11/7/2021,false,Quebec Charlie Sierra Oscar Kilo Delta Yankee Hotel Juliett Romeo Victor Mike,OC,false
815,9/26/2021,true,India Hotel Charlie Papa Uniform Foxtrot Mike X-ray Delta Tango Quebec Zulu,NA,true
816,11/20/2021,true,Papa Lima Foxtrot Charlie Kilo Hotel India Juliett X-ray Tango,EU,true
817,9/4/2021,false,Papa Lima November Romeo Charlie Echo India Sierra Golf Victor Mike Delta Zulu Tango Juliett Bravo Yankee Foxtrot X-ray,AF,true
818,7/23/2021,false,Bravo Hotel Oscar Delta India Victor Sierra November Juliett Romeo Golf Kilo Mike Tango Yankee Uniform Papa Zulu Foxtrot,SA,true
819,7/19/2021,true,Mike Echo Tango Yankee Quebec Bravo Lima Whiskey Romeo Victor Alfa,NA,false
820,7/10/2021,false,Golf Mike Uniform Sierra November Hotel Delta Charlie Juliett Oscar Romeo Bravo Victor Papa Kilo Lima India,NA,false
821,7/7/2021,false,Juliett November X-ray Mike Charlie Kilo Hotel Alfa Sierra Zulu Victor Golf Foxtrot Echo Papa Whiskey India Romeo Tango,AS,false
822,12/15/2021,true,Zulu Quebec Romeo Juliett November Bravo Echo Mike Kilo Oscar Charlie Hotel India Victor Whiskey Golf Sierra Foxtrot Delta,NA,true
823,7/20/2021,true,Tango Foxtrot Mike Lima Juliett Oscar Romeo Victor Charlie Kilo Quebec Echo,OC,true
824,9/3/2021,true,Mike Foxtrot X-ray Echo Juliett India Kilo Hotel Charlie Yankee Lima Romeo Quebec Bravo Sierra November Zulu Golf Alfa,AF,false
825,12/27/2021,true,Kilo Tango Whiskey Bravo Oscar Quebec Zulu Uniform X-ray Yankee Victor Mike Sierra,AF,true
826,11/30/2021,false,Bravo Oscar Charlie Hotel Lima Alfa X-ray Golf India Yankee Whiskey Tango Mike Victor Kilo Juliett Echo Papa,NA,false
827,7/1/2021,true,Zulu Papa Oscar Echo November Victor Romeo Whiskey Hotel Mike Sierra Kilo India Juliett Tango Quebec Bravo Alfa,NA,false
828,12/6/2021,true,Echo November Foxtrot Romeo Papa Charlie Victor India Uniform Hotel Tango X-ray Juliett Sierra Mike Kilo Lima Zulu Golf,EU,true
829,10/19/2021,false,Mike India Echo Zulu Romeo November Quebec Foxtrot Tango Charlie Oscar Uniform Golf Kilo Victor,NA,true
830,7/8/2021,true,Mike Zulu Lima Romeo Tango Oscar Alfa Whiskey November Echo Quebec Foxtrot Kilo X-ray Delta Charlie Yankee,NA,true
831,8/5/2021,true,X-ray Hotel Echo Uniform Quebec Golf November Juliett Lima Zulu Foxtrot Charlie Mike Oscar Bravo Sierra Victor,NA,true
832,11/18/2021,false,Hotel Charlie Lima Quebec Zulu Uniform Golf Oscar India November,AF,false
833,10/11/2021,true,Juliett Quebec Charlie Oscar Zulu Mike Yankee Sierra November Victor Uniform Bravo Lima,NA,true
834,12/11/2021,false,Charlie Delta Uniform Tango Whiskey Yankee Sierra Papa Hotel Juliett Lima Alfa Zulu India Quebec X-ray Oscar Victor,AF,true
835,7/28/2021,true,Juliett Oscar Charlie Victor Echo Yankee Bravo Hotel Whiskey X-ray Tango November Sierra Papa Romeo Golf,NA,false
836,7/7/2021,true,Foxtrot Sierra Zulu Mike Romeo Kilo Quebec Whiskey November Bravo,NA,false
837,12/30/2021,false,Lima Romeo Delta Kilo Sierra Golf Mike X-ray Tango November Papa,NA,false
838,10/5/2021,true,Kilo Alfa X-ray Uniform Bravo Quebec Juliett Oscar Mike Foxtrot Hotel Lima Whiskey Victor Echo Delta Yankee Zulu Sierra Papa,NA,true
839,12/14/2021,false,Foxtrot Golf Hotel Uniform Quebec Juliett Whiskey Lima Victor Delta Mike Papa,AS,false
840,11/27/2021,false,Echo Uniform India Oscar Alfa Foxtrot Kilo Sierra Papa Victor Zulu,EU,true
841,8/7/2021,true,Kilo Hotel Uniform India Bravo Yankee Quebec Lima Sierra Tango Foxtrot Whiskey Delta X-ray,NA,true
842,7/26/2021,false,Sierra Whiskey Mike Lima Charlie India Quebec Bravo Yankee Kilo Papa,SA,false
843,8/26/2021,false,Victor Alfa Uniform X-ray November Echo Golf Kilo Romeo Sierra Whiskey,AS,true
